{"effect_id":"effect-push-001","effect_type":"git.push","approval_id":"approval-push-001","q_id":"Q-DEMO-001","repository_id":"GDS-DOCS","execution_id":"exec-001","attempt_id":"attempt-001","requested_by":"orchestrator-001","requested_at":"2026-07-25T00:20:00Z","idempotency_key":"GDS-DOCS:push:2222","expected_branch":"main","expected_remote":"origin","expected_head":"2222222222222222222222222222222222222222","safe_commit_set_digest":null,"actual_diff_digest":null,"allowed_operations":["git.push"],"expires_at":"2026-07-25T01:20:00Z","conditions":["commit receipt exists","remote unchanged"]}
