{"effect_id":"effect-commit-001","effect_type":"git.commit","approval_id":"approval-commit-001","q_id":"Q-DEMO-001","repository_id":"GDS-DOCS","execution_id":"exec-001","attempt_id":"attempt-001","requested_by":"orchestrator-001","requested_at":"2026-07-25T00:10:00Z","idempotency_key":"GDS-DOCS:commit:cccc","expected_branch":"main","expected_remote":null,"expected_head":"1111111111111111111111111111111111111111","safe_commit_set_digest":"sha256:dddddddddddddddddddddddddddddddddddddddddddddddddddddddddddddddd","actual_diff_digest":"sha256:cccccccccccccccccccccccccccccccccccccccccccccccccccccccccccccccc","allowed_operations":["git.commit"],"expires_at":"2026-07-25T01:10:00Z","conditions":["secret scan passes","existing receipt absent"]}
